mera haq tha teri, akho ki chhalakati may par 
yaar ladki shandar hai
dhadakate dilo pe jawaani rahe
use mil gayi pyar ki ik pari
mai naachu tum naacho
ye sach hai e he o o e he o o
kabhi khushi kabhi gam, tara ram-pam-pam
guzarati nahi zindagi bin sahaare
wo bhi mujhe karna pada aiyo amma
main madrashi chhokri, mujhe tumse pyaram
unchi udaan hai, palako pe jaan hai
rahana mere sang ma har dam
phir kuch nahi bhata, jab rog ye lag jata
tu mungda, oh mungda, mai gud ki dali
chhod  maza hath
panv padi janjir hay
mamata hi lutaye jiske nayan, ho
in hatho ka jadu jo dikha du, tujhe ghar tak abhi mai pahuncha du
amma seena tane banhe khole 
sasuraal se dekho hum aaye
payal ki jhakar raste raste
mai kho baitha hosh mujhe yu kar dala madhosh nashe ki pyaali ne
puchho puchho puchho puchho
zaraa dil kee jaanib nigaahein jhookaao
dekho na, tere mere milan ki ye raina
dekho phir aaya hame kar raha hai yeh bore kaun hai
ya kahu khaiyaam ki rubayi
gullu gullu, gullu gullu 
kal aaya tha kal gaya, kal gaya
o hay jaan-e-bahaar aa jaa dil ke qaraar aa jaa
chhedege kabhi na tumhe, zara batalado hame, kab tak ham tarasege
yadi phir bhi tu phire dil ko tham 
maujo kaa dosh nahi hai,  ye dosh hai aur kisi ka
are pad gaya inkam taiksam, jay govindam jay gopaalam 
rasiya ki ras bhari baato me aa gayi
jine kaa to jaane kaha dhang gaya hai
yun hi aavaaraa phiregaa ye teri zulfo ke tale
chal pade safar ko to mud ke kya dekhna
aaja piya tohe pyar du, gori baiyaa tope vaar du
khatao ki talim kya ho gayi
duneeya ko dikha denge oh 
shokhiyon ka sama shokhiyon ka sama
tumpe to hum mar mite hai abhi se jane aage hamara kya hoga
khud apne hath se ye khun kar chuka hu mai
iktaara bolo tun tun kya kahe ye tumse, sun sun
tere reshami julfo ki janjiro se
jan mile babul ke ghar se, nit mann pyasa, nit mann tarase
tota maina ki kahani to purani purani ho gayi
mehanat mera kaam dena usaka kaam
naachenge aaise hum, nachenge wo kya
fir se ro ro rha hai 
ham toh jis ka war usi par dharana jane
apne betabi-ae-jajbaat kahi hai tumne 
dukh hee sukh ka gyan dukh hee sukh ka gyan
oh re tal mile nadi ke jal me 
udhar aap ki photo se saji divaar pe
na ye chaand hogaa
tute agar sagar naya sagar koi le le
juba pe raz aaya to juba ko mod ke rakh du
palat ke jab ana, ye lat ye nazar lana, ye chhota sa nazrana
mujhe dosh na dena jag walo
tarazu me tole ha tarazu me tole chhote insano ko
man mandir me pooja pooja 
madhosh ada ye alhadpan bachpan to abhi rootha hi nahi
antam fantam chhod de baabu
kya bin mage hi god bhari, patzdh dali hri hue 
na ye chaand hogaa
aaj is zamin pe to apana raaj hai
jab se hai dekha tujhko ho gae gulam tere
bharat kaa rahane waala hoo, bharat ki baat sunaata hoo
mujhse pahale kitne shayar aaye aur aakar chale gaye
ke ye badan ye nigahe meri amanat hai
dil dhundhta hai fir wahi
jab nazar saaqi ki padati hai sambhal jaataa hai
hai tere ghesu uff teri ankhiya 
panaghat ke pichhe ja baithi chhip ke meri sajaniya
dekhaa ek kvaab to ye silasile hue
jeck and jill went up the hill
dhakke pe dhakka, rele pe rela
mujhape hai itana aitabar, maine kiya hai tujhase pyar 
haye haye haye dil ki halat sharabi-sharabi
mera aanchal jo jara dhal gaya
o garama garam hua, pyar lachchhedar shuru
chahe koi chamke ji chaahe koi barse 
bade masum katil ho , saja dete ho tum mujhko
mar bhi gae to denge duaae
do hatho ki dekho shan, ye allah hai ye bhagwan
ye dil ab tak bhatakta hai teri ulfat ki raaho me
beta tere kisse pe dil mera roye
mil rahe hai vaha par jami aasma
sabse pahle suno miya karke warjish bano jawaan
kal aaj aur kal ki pal-pal judati jaaye kadi
a teri taqder bata dun
mai bhi kyaa chiz hun khaayaa thaa kabhi tir koi
mere aage bichhte jaaye dilawaale naadaan
mere khwabo ki shehjadi jaha tum muskrati ho 
o chaand 
kaam to bataao, kaam seedha saadha hai, bolo bolo
sirf dastaan ke liye
zindagi ek musakan hai, dard ki koi pahchan hai 
mera naam abdul rehman pishta wala main hu pathan
chup ho ja amiro ke ye sone ki ghadi hai
insan vo khud sambhle auro ko bhi sambhale
kahati hai ye nazar, kab kya ho kya khabar
bikhra ke zulfe chaman me na jaana, kyo
yari tutadiye te, tut jaaye
mohabbat ka matlab
dekhi jo gwalo ki toli, koi gujariya boli
jab zara bhi naqab uthaungi
rup chand hai resm wala 
reh naa jaaye teree meree baat aadhee, mulakat aadhee
yahi kahoge tum sadaa ke dil abhi nahi bharaa
chale aaj tum jaha se, hui zindagi parayi
ruke ruke tum, ruke ruke ham, socho zara
dil hai pagal aana na too iski bato me
zamane mein sabase purani yahi pyar ki hai kahani
ye kahi toot jaega, ye kahi phoot jaega
mahabub ka jo, bas lete hue nam 
mere saamne waali khidki mein
chali aayi main akeli bikaner se
kabhi tune shishe me apna muh nahi dekha
khada hu kab se mujhe intzar mera hai
pyaar ke hazaar dip hai jale hue
mat puchho meraa devaanaapan
aaya udane baalo ko tere
jab bhi milte hai hum tum
naino me sapana sapano me sajani 
raz khulne ka tum pahele
itana bhee pas mat aao, ke dur jana mushkil ho
tumhare geet gayenge
kahi se aaj ka insan kahi pahuncha hai 
chalate hai ye jaadu laal laal gaal
bade achchhe lagate hai ye dharati ye nadiyaa ye rainaa
apna to khun paani jina-marana bemaani
banh chhuda ke dauda ghoda dum utha ke dauda
pade inse 
dil chiz kya hai, aap meri jaan lijiye
ek raah rukh gayee toh aur judh gayee
kya kahta hai badal kyu mosam hai pagal
rang-e-jawaani tauba re tauba
khadi hu main darwajje pe badi der se
bandagee toh bandagee toh lijiye saahab
do hafte huye khushi me pi ki mujhko mila pyar tera
nikhar nikhar gayee savar savar gayee 
nasha hota hai kaisa, bahkate hai kadam kaise 
jivan ki bagiya mahakegi, lahakegi, chahakegi
teri kasam hai mai to gaya tha pyari bate karne
he he he raste me na chhodo ji ghar me le chalo
apne jawa dil pe hume kal tak bada naaz tha
jo chhup gaya hai pehli nazar ka, pehla salam lekar
na sata ja ja abb na chalegi yaha chale teri
bhari rahegi rahagujar jo ham gaye toh kuchh nahi
kyon ji main jaan se anjaan kaise ban gayi
mar ke tangdi usko toda chana zor garam 
aadami ko chaahiye vaqt se dar kar rahe
yahaan ajanabi koi nahi, ye hai aapaki mahafil tamaam
jivan ke safar me tanhayi, mujhko toh na jinda chhod egi
man ke mithe dard ki gahraai maar gayi 
to wohi kahen ke mai kya karu
tumhe chhin le meri baaho se koyi
kaali ghataa hai, aa aa, mast fazaa hai, aa aa
iktaara bole tun tun tun tun tun tun 
haan tum bilkul waisi ho
maza aa gaya jit ka haar me
piya der na kar aa mil zara dekh le aa kar parvane
jo bhi ho tum khuda ki kasam lajawab ho
haan gaana aaye ya na aaye gaana chaahiye
tqadir na bas me dale
ho, chaal hai ke mauj ki rawani
chashma utaaro phir dekho yaaro
ai ma, ai ma teri surat se alag
ban ke panchhi gaaye pyar ka tarana
jag gaye to, jagane do, achchha
sabko tha malum sham ko khulegi ram ki botal
o o o o o o, jine kaa saamaan mila
par khud rahe khadi
raushni chali gayi
o lambi lambi umariyaa ko chhodo
intazaar intazaar intazaar karo intazaar karo
vo mukh dekhe kuchh bole na
kya huwa teraa vada
reshami julfo ke saye me jine do mujhko
khizaa ko ye ilzaam kyun de diyaa 
bala mora balepan ka ho gai re jan ki chori
mera katil mere ghar me mera mehman ho gaya 
apni jagah se kaise parbat hil jaye
pehle milan kee yade le kar aayee hain yeh rat suhanee
bas ik baar kehdo tumhaare hain ham
ho lala ho lala, ho lala ho lala
ke mujhko dikhane ke liye tune sab wo sambhale honge
aaya main aaya dil ka kharidaar
mera naam hai chameli, main hu malan albeli
lauta jo diya tumne, lauta jo diya tumne
monica o my darling, monica o my darling 
kya jata agar koi dil ka nagar 
jaate jaate mithha mithha gham de gaya
abhi chhedenge galee ke sab ladke 
dukh mein sab mukh modenge
mohe bavala bana gayi va ki batiyan haan batiyan
kitnee pyaaree pyaaree teree yeh naadaanee hai
kyu kyon ki jamana to hai noakr biwi ka
roz na sataaoge, kabhi nahi
are jayegi kaha tere pichhe ye pora ayi jo ayi
govinda aala re aala zara matki sambhaal brijbaala
mere mehboob tujhe meri mohabbat ki kasam
tu kaha gayi thi tera mar jaye sawariya 
ki chhori koi pasand na aaye tujhako
na aise khafa ho kabhi to tamnna nikalo
mohabbat ki jhuthi kahani pe roye 
ham bhi to kuchh sune, hamase kya raz hai
aadat na chute re kabhi sun jiniya are ja
tun tuna tun tuna tun tuna
aake mere pas raho
ek din to ye phul sunega bulbul ka shikva
roz hamne baiyaan ye fasaana kiya
ajanabi tum jaane pahachaane se lagate ho 
balkhati belein masti me khele
tere naseeb mein main hoon ke nahi
tune hi mujhko nahi dekha, mai karu kya
kitna badal gaya inasan
la la la la
kho jaye dhadkan me teree dhadkane mere mann kee
jijaji  jijaji meri jiji hai anaadi 
dekh hame koi jale, koi jale haath male
khel ye kaisa re, kaisa re sathi
bolo re sab dhan dhul samaan re
koi kahe raat haaye roti phire
oy oy oy oy
masti ke saazo pe ga gaao
ab to ye hai hal ke jab se bita bachpan
man se man ka deep jala le madhur milan ki jyot jagale
tujhko teri naujawani ki kasam
yaar kudi shandar hai
har koi diivana hai 
raat bhar muwa sovan na de thappo lagave ghadi-ghadi
sar kisike samne jhuk jaaye mera, ye mujhe manzur nahi
aavara chhaliya anaadi divana
ud gaye baadal aa gayi aandhi
khau, khau, khau, khau, khau
phulo kee mehak kaanto kee chubhan
din to so fere teri gali me lagata
vo kaun hai vo kaun hai jag jisase darta hai
tab kahi rangin ye fasana bana aaha
kise malum ke ye aadmi jayega kidhar
milate hai bichhad jane ko
ab tum khud hi faisla kar lo, mai kis jube wala
bas ek baar bas ek baar, mera kaha, maan lijiye
baithe ho kya ye lekar, ye ghar hai ya hai threatre
samjhe madam
hazaaro rang ke nazaare ban gae
dikhe har ghadi naya chamatkar ma ki aankho me, ma ki aankho me
mummy ko to daddy se chhudaana chaahiye
are pine vaalo ko pine kaa bahaana chaahiye
bas ab na mujhako tokna, na badhake raah rokna
dhundhe tera pyar raste raste
bambai se aaya mera dost, dost ko salam karo
wo chahe to kar sakta hai wo chahe to kar sakta hai
bhagvaan kare ye aur badhe 
ye to meri hai saheli, dilavaali alabeli
saath chale mod pe aake hame chhod  diyaa 
sar jo teraa chakaraaye, yaa dil dubaa jaaye
tu hai aisi kiran jo raat dhale
amar akabar enthoni, amar akabar enthoni
sangam jaha hai
puchhegi har nigah kal tera thhikana
kar diya dil ko tere havaale
kaise batau kaise batau
padi jahaan chhaaon hamaarii saj gayi mahafil
ye wakt ki hera feri hai
ye kal ki bat hai aankh meri fadki 
kitni jaldi yeh din dhalate hain haay, taata
gum fizul hai gum na kar aaj ka jashn kam na kar
dil toh dete hai lete hai log kayi baar
aage iske kuch bhi nahi tu pad gayi kis uljhan me
hoy tum to machal gaye, ho ho ho
chal chameli baag mein, mewa khilaunga
hoy ayi milan ki bela jismein kam kare thi banno
teri nazar, banake zubaan, lekin tere paigaam diye jaye
apake kadamo ke jaisa duniya me kaha aram koyi
chhupakar ye bhi milta hai mai naam bataun na na na na ji
zaraa dekh lo is taraf muskuraa ke
dur rahati hai tu, mere paas aati nahi
teri tasvir hai nigaaho me
varna hamko nahi, inko bhi shikayat hogi, shikayat hogi
banavat me dil ki hakikat chhupana
kale bazar ki ek toli pulis ne dhar li
baho se bandh lungi, ulfat se gher lungi
us kaa ko_i pech bhi dhilaa hai
panch nahi chhh nahi ha are hi hi hi
dhuaan ban gayi hai khyaalo ki mahfil
aao saja de ye rat
likh liya han zara padhake to sunao
hup two three kick, du ru cha cha cha
khinche chale aaoge, jaaoge jaha
ki sharafat chhod  di maine
main ye geet sunata hu 
aake jaye na bahar kabhi apne chaman se, apne chaman se
chhutti karke chhod unga
is dharati pe jisane janam liyaa, usane hi paayaa pyaar teraa
ek apni dagar ek apna nagar
ek dal par tota bole
lifaafe ke liye lekin pate ki bhi jarurat hai
dekho logo zara to socho bani kahani kaise
pyar abhi to, ho, o o
aisi chahne wali kahi na payega 
ja main na teri madhumati na dhanno mera nam
dekh tamasha ui dekh tamasha ui dekh tamasha ui
degi taanaa tere naam kaa
ke vo kya bechaara le gaya 
mitane ke sau sau bahane banenge
is laathi se angrez dar ke bhaaga hai
pyar ki raho pe chalana sikhaya
meri bahki nazro me khoyi huyi si
mera man mera tan mera naam
abhi jo chupau di to vo chhupti nahi hai
mai madrasi, mai gujarati, mai ek rajasthani
yaar kapda shandar hai
ham vo nahi jo pyaar me rokar guzaar de
hum to khaali maal ke rasiya 
mauke bhi kabhi kabhi milte hai pyar ke
main maike chali jaaungi, tum dekhte rahiyo
meri saanso me basi kushabu teri
subah ho ya ho rat
dole meraa man, aise jaise nayyaa
chandi ki divar na todi, pyar bhara dil tod diya
dur se hoti hai karib se hoti hai
duneeya ko teree tasawir bana du
ruthhe rahenge aap jo ham se
resam ki dori, resam ki dori
nikla chand to ham dono bhi khet se bahar nikale
magar sachche lagate hai ye dharati ye nadiyaa ye rainaa
mai to sapne tere 
phir le jao jeb khali, baju hat burke vali 
patala hai hal-e-apana, lekin lahu hai gadha
dil me jagaye sau tufaan
kiya hain koi vaada, to dar kiska 
mera dhiraj dol raha hai, laj rakhe gangajal
ye aasmaan ye badal ye raste ye hava
nashe ke ghunt pee to lun
o ho ho, ho ho
itane to bure ham na the
mai kahti hu tune mera dil le liya
balam babua bedardi saavan aayaa aajaa
nache gaye sath
abhi abhi to aai ho, bahaar banake chhaai ho
la:	o aa jaa re
mil gaye rang-e-hina khoon-e-jigar aaha
rang bhare hontho ka, rang bhala kisne chhina
dhundo dhundo re sajana dhundo re sajana more kan ka bala
aaja pyare paas hamare, kahe ghabaray, kahe ghabaraye
gala phad kar chillana
aya samay bada bedhanga
ulfat ke maaro ko kya maarna, jan de dete hain jo khushi se
jidhar jidhar bhi mili nigahe, lagi katare daye baye 
bat hai ye bilkul pakki bholi si aati ho nazar 
ye hum kya jaane
ye lo mai hari piya
raaste me ruk ke dam lu, ye meri aadat nahi
gam jisane diye hai bahi gam dur karega
na dar zalim zamane se, ada se ya bahane se
dur hai manzil dur sahi, pyar hamara kya kam hai
mil gaye naina se naina oye kya bat ho gai
hawae ag bhadakae fizae zahar barasae
idhar jhumke gaaye zindagi, udhar hai maut khadi
hami par taane kasate hai
aise koyi apno se ruth nahi jata
reshami rate roj na hongi, yeh saugate roj na hongi
kahi bite na
ye resam ki dori haye resam ki dori
kyon chale aaye ho kyon chale aaye ho bebas pe sitam dhane ko
ruho ke ruho se
rasta khud apane ghar ka bhul jata hai, bolo bolo
mere khwabo ko tum ashko me dubote kyu ho
mujhe meraa ghar tak yaad nahi, yaad nahi
mujhko meri manzil mil gayi hai
o back to back 
jata tu nirmohi tu harjai tu kapti tu chor
kya dekhate ho kya dekhte ho surat tumhari
piya piya piya
apne dil me aag le ke baadal kaare aaye
hath jodta hu tere paw padta hu chal mere bhai
ho kabhi khole na tijori ka taala
mera geet mere dil ki pukar hai, jaha main hu wahi tera pyar hai
sab ko nisha banate nahi khud harajai banwre ho tum
ek chor ek sipahi aha aha
ek pal hai hasna ek pal hai rona
    mai hun lahar aur saahil hai tu
 
dekhe hame nasib se ab apane kyaa mile 
are khun pasine ki jo milegi to khayenge
kisi ko mile hai chhalakate piyale
badal jaye agar mali chaman hota nahi khali
jisko salam karu sau-sau baar
aa pyar ki raho me baho ka sahara le
kahi kinaaraa hotaa nahi
apani ankho se duniya dikhalaunga
vo tikhe tikhe do naina us shok se aankh milana tha
mere jivan saathi pyaar kiye jaa, jaa jaa
apne dil se puchho dil ko pahchana kaun
mai yaha jite ji mar gaya
daal-roti khao prabhu ke gun gao 
udhar gal pe aanchal fisla, idhar kaleja hath se nikla
naino me nindiya hai, mathe pe bindia hai
thak jaate the ham kaliyaan chunte
meri kab marzi hai hum me ho ye duri
hamako hai sab pata, dil me kya chor hai
ja, abhi to hui hai yari, abhi se hi beqarari, din to zara dhalane de
surat se to achhe ho tum dil bhi jara dekhne do
o yaar ladki thanedar hai
gori-gori banho pe kagana chadha dun
saveraa jab huaa to phul ban gae
adami musafir hai adami musafir hai
ise jab liyaa taq meraa dil huaa faq
jale man teraa bhi, kisi ke milan ko
tu dil me bhar de pyar bhala ho tera
kaisi zulmi kaisi zulmi banayi taine nari 
kahi kisi roz yu bhi hota 
aansu hai khushi ki ladi
solah singar meri behana karegi
jag me rah jayege, pyare tere bol
de aur bhi dil inko jo na de mujhko zuban aur
arey yak-b-yak yak-b-yak koi kahi 
badh uthe pyar ka har kadam aur mite bair ka ye bharam
are ab jhumakaa tute ke meri bidiyaa chhute
na to yaha jivan hai na koi maut hai
phir bhee kabhee abb nam ko tere, aawaj mai naa dunga
wo bhi kya din the hamein dil me bithaya tha kabhi
apni kashti ko sahare pe tere chhod  diya
jo khubsurat koyee apna humsafar hota
humne sanam ko, humne sanam ko
baalam bedardi ne mohe phunkaa gam ki aag me
koyaliya chup ho jaye jab usaki payal bole 
oh ho maine kaha kab dikhne me tu hai aisi buri
lekin pyasa khud rah jaye 
hey main bambai ka babu 
chehro se ho anjaane ham dil to dil ko pehchaane
kisi aur ki hone ke dar se tera dil bhi dhadakta hoga
aankhe hai jaise mayke pyale bhare huye
hansi ke parde me rone se fayada kyaa hai
hamane dil de bhi diya ehad-e-vafa le bhi liya
kiran pari gagari chhalakaye 
gam ko gale lagaa lu jo gam aap kaa mile 
kabhi bole na kabhi bole haan, teri adaaon ne mara
gumshuda kushiyo pe, gumshuda, gumshuda
leke gusse me pyaar, balam ji abb to hasso
sahab ban ke kaisa tan gaya
kitne janam beet gaye hai tumhe paane me
bahut na tarsana, tum laut ke aa jana, ye chhota sa nazrana
o raat dhal chuki hai subah ho gayi
luta kahi mara nahi jine ka sahara dekho ji 
hamne to pyaar me aisa kaam kar liya
la la la, la la la la, la la la, la la la la
dil chaahiye dildaar chaahiye, o dildaar chaahiye
mast hawa ne baat koi aise kah di kano me
aye panchee
ho khu-ba-ru chaand se jo hasin berukhi uski jachti nahi hai
koi nishani chhod , phir duniya se dol
mere hazaro deewane, ab main khud ban gaya deewana 
ye samajho aur samajhao thodi me mauj manao
twist twist twist twist
uski hi lau me vo jal-jal mare
dil bechu, hai koi lene vala
himmat hai to aaja ye bhalaayi ki dagar hai
dil mai aag jab lagegi hooo 
tujhse lipatkar jo ro lete ham, aansu nahi the ye moti se kam
abhi abhi to aai ho  abhi abhi to
aag si jalati rahi, girati rahi shabanam
takdiro ko jod de aisee kadee aaj tak nahee milee
duniya ko tab ginti aai 
doli laa ke chhod unga
saye me talwaro ke, dawe hai dil daro ke
achhi achhi surto se najre ladayenge
bend baja bajega dhum dhum dhum
chun chun karati aayi chidiya
mere bag kee aye najuk dalee, tuje harpal nayee bahar mile
dil ki aag bujhaaye jo barasaat nahi koyi aisi
aise ho milan, jaise dhup chhaya
mele me rah jaye jo akela
nazare ho gaye qurban in nazaro par
pahle zara aap muskurayiye
mai rickshaw wala, mai rickshaw wala
kaise karu prem ki mai baat, haye
nai mulakat hai
nit mann pyasa, nit mann tarase
yaar ho bando se ye sabse badi hai bandagi
topi topiwaalon ki chhedo dhun matwaalon ki
meri bhi jindagi, kaante se phul ho
hamko dar hai
palke bichhau mai dil me bulau mai
aankh to tere jalvo me gum hai
kisi kaa pyar leke tum naya jahan basaoge
aa gayi hai pyaar le ke ab suhaani bhor
roshni ho na saki dil bhi jalaya maine
dhadakano me tere git hai khile hue
meri aawaz suno, pyar ka raag suno 
umar ye nahi aise dukh jhelne ki
kitni pyari hoti hai ye bholi si umar
kitna bura anjaam ho, dil muft me badnaam ho
    the sailing beat continues till it fades out the sailor is gone
ye soch le har baat ki daataa ko khabar hai
lina o lina dil tune chhina
mange se to koyi tera adhikar naa dega
kaun nahi basi ki dhun kaa gulaam
nakamiyo se nata mera joda
mai hun ek chhoti si maati ki gudiya
me baharo kee mehfil sajata rahu
ho na najar mil saki
jo chiraago ki tarha jalte rahe
chal le chal khatara khinch ke
in aankho ka rang ho gaya gulabi-gulabi 
thak gai aaj bahut mai ab jaane de naa milege phir kal
jo khushee se dard sah gaya
mohe pi kaa sag da_i de
wo juda kyaa huye zindagi kho gayi
kali kali chudi hai gore hath me
kuchh paas to aa kar dekho
jaisa gora koi londan ka ha
jane kya hoga baho me jo aaye haye oye hoye 
didi ki tarif me hamesha nayi kavita roz sunaoge
ju ju ju ju ru ju
layenge nayi pyaliya baja baja ke taliya
khilate rahege ban ke kali ban ke 
hat jaao ji, bujhaao ji
muskate ithalati gati aayi zulfe khole 
mere dil me chale aao, ke ye ghar bhi tumhara hai
gam ka fasana ban gaya achchha
ye koi do dilo ka saiya mel nahi
jane kaha kab kisiko, kisee se pyar ho jaye
mera juta hai
patvar bhi chhuta
kaun kahe is or tu phir aye na aye
ab pyar na hua to phir kab hoga
pine kaa maja kya hai pee kar bhi nahi samjha
taa na dere na
mat ro behna andar jake, mat ro behna andar jake  
chaand ghabra ke jo gir jaye to phir 
jhoot bole kauva kaate, kaale kauve se darriyo
zara si raakh rakh di, bewafaa tere dikhaane ko
ho sukh mera lele mai dukh tere lelu
hoga yu nasha jo taiyyar woh pyaar hain
tujhe raat din pujanaa chaahataa hu, vafaa 
itna sab kuch karke phir dil me bithaoge
tu ban ja sathiya
ho mujhe kehte hain
agar tum ik kali maango to mai saara chaman de du
vo tikhe tikhe do naina  us shok se aankh milana tha
masti me chur ghane pedo ke niche
mammi se mai bolunga sath mujhe bhi le jaaye
na ho jisaka koi vo milane ki fariyad karata hai	  
dur tujh se mai rah ke bataa kyaa karun, kyaa karun
baho me kya in nigaho me kya 
ek kans mama ban baitha 
baba udi baba, udi baba, udi baba
kahe ko ho jaldi ki ham to hai chal di apne dil ke sahare
kuch din ki hai zindagi
munh chhupa lena hamse wo aapka
jo tum muskuraa do nazaare hanse
gam ka fasana ban gaya achchha, ek bahana ban gaya achchha
mai chali mai chali
kaali palak teri gori
tu jo mere saath chale logo se kya darna yaha
chun chun karati aayi chidiya
kya kya jatan karte hai, tumhe kya pata
tere dil ko bhi sanam tujhse shikayat hogi
palko par ek bund sajaye, baithee hoo sawan le jaye
o chaand suraj sitaaro se khelu
duniya mein wajud uska kudrat ki inaayat hai
ki tum meri zindagi ho, ki tum meri bandagi ho
duniya nai basane, o bedard zamane
daaman ko chhudaaye kaise
pahaado ko chachal, kiran chumati hai 
agar ise samajh sako, mujhe bhi samjhana
thode me guzara hota hai 
gili gili gili gili gili gili
pyasa hai dil sanam, pyaasi ye raat hai
dal ke ghunghta rup ko apne aur nahi mai chhupaaungi
aur zara si de de saaki, aur zara si
ke o mainnu pyar kardi hai he he he
na khankao khan khan kangana
bhigi-bhigi palke, chham-chham aansu chhalke
dadi tumhe hum to mana ke rahege 
aadha hai chandrama
yaha vaha fija me awara, abhi talak yeh dil hai bechara
der se man meraa, aas liye dole
tum bekhabar main hoon magar 
ye maanaa, na jaanaa, tu kahaan chali 
dhire se jana 
na jane kis pe aayega
teri dulhaniya launga
me marugi
zindagi ek vanwas hai kat kar sabko jana padega 
yeh tujhako kaise samjhaau, tu divaanee hai
koi to hoga mera sathi koi to pyas bujhayega
i need you you need me 
tum yaha rahoge ok, tum yaha rahoge thank you
aise manmauji ko mushkil hai samjhana, hai na
tirachhi nazar, tikhi adaa
tumko swaami maane tumko swaami maane
(aise me mat rok bedardi
tujhko bhul naa paaungi
o piya, dori se baandh le gori re
jab se tujhse muhabbat mai karne laga
balam ji abb to hassso
ha dekhi na dono ek jagah hote hai mard bade shaqi
haai usne macha diya shor
sochata hu agar mai dua maangata
is dil me abhi aur bhi jakhmo ki jagah hai
chand chura ke laya hu, ho chand chura ke layi hu
kabhi tanhaiyo me yu
koyee na koyee bulayega, khade hain ham bhee raaho me
apna ye vachan nibhayega mati ka karz chukayega
vahi zajir pairo me
mazhub hai apna hansna hansaana
humka dulhan banayi de thandi 
nahi aur ko_i thikaanaa hamaaraa
machalti-jhoomti thandi hawaye kehti hai
jaise rat akeli me kya
rotiya kam hain kyun kyun hai akaal, kyun hai akaal
umr bhar pyaas na bhujh payi to phir 
do din ki mohabbat me aakhir
ho dekho na aa gaye mastane chha gaye 
dekho mujhe kuch hosh nahi hai
pyar ke suro par, apni hi dhun me 
aa pas aa teree har sans me mai jau sama
ham hi mile the kabhi jamuna kinare jamuna kinare 
hal-e-dil hamne sunaya to bura man gaye
haiya o ganga maiya, haiya o ganga maiya 
na ghar aaya na daftar aaya ye to hostel aa gaya
macha diya shor
inape zavani luta do 
chain mera kyu lute aise jiwansathi se
aa   
khushabu lekar jaate hai
meri bhi ek shart suno ji, are bas, bas, bas
aaha, shadi ke liye rajamand kar li, 
ke jis gam ne mera daman badi mushkil se chhod a hai 
chaahe dharti phate ho chahe ambar phate
thoda sa hasa ke thoda sa rula ke 
kaun se gagan ke tale, dil yeh mera le ke chale
aisa main deewana hu, aisa main mastaana hu
khuda jane aisee suhanee ghadee phir 
jo tune mujhe thaam na liya, o sau rab di
tum dur nazar aaye, badi dur nazar aaye
aaj ki raat
tu btla tujhko hai pata
maine samjha tha ke honge baaten aur
tune jab jab aankh milayi, dil se ek awaj ye aayi
chhaliya mera naam
kaun thi wo ladki maine jab puchha bol tera nam kya
gayi udasi raunak chhayi
ichak dana bichak dana dane upar dana, ichak dana
jaate ho jaana jaana
mahafil kya tanahaai mein bhi
in adaao ka jamaana bhee hai divaana
aur zara si de de saaki, aur zara si
dono ke man se man ke milan se lagate hai saragam ke mele
ab to mumkin hai bahakna mai nashe me hu
chumata hai mere kadmo ko gagan aaj ki rat
jaisa des, vaisa bhes, phir kya darana
mahmaan kab ruke hai kaise roke jaayege
yeh waada haan waada yeh waada raaha
khol ke rakhiyo apni jholi bhar dega daata
kahe ka dar hai bali umar hai, arey chhodo bahana na na
thhandee thhandee aaho kaa salaam de gaya
pipal ke upar ja baitha chhip ke meraa sathi
aasaman se aaya farishta, pyar ka sabak sikhalane
bahaare bech daali, phunk dala aashiyaane ko
uske aanchal ka rang aa aa aa aa aa aa aa aa
in bhigi fizao se, in thadi havao se
kai sadiyo se
haan chal mein lachak daiya re daiya
ho balam babua bedardi saavan aayaa aajaa
duniya ki majburi hai phir taqdir jaruri hai
aaj khelegi dudh se ye holi
kangana ho kangana laye ki ghar laut ke aaye
tir tirchhe chalaane ka fan allah allah
magar jaha bhi hoti hai ae mere dosto
maine din-rat mohabbat ka teri jam piya
tumhari adaao pe marte hai ham
sabaa baage vafaa me
is liye naaj ka parda hai mere chehre per
duniya jise gati hai us git ko dohara le
sachchi lagan jo ho to, parbat bhi dhul hai
bhashhaa ki taqaraar nahi, mazhab ki divaar nahi
pyar ka jadu hampe chala ke
nigaaho me aise ishaare huye, ishaare huye
kate agrezi baal, baandhaa resham kaa rumaal
tere hotho me amrita ghol duu, ghola duu
pyar ki adaaye, zamaane ko na bhaaye 
ae pyaar teri duniyaa se hum 
mast hava ne ghunghat khola kaliyo ka
magar usko dil me chhupana bhi mushkil
