Song lyrics	Mood	Offensive
tut jaaye jo koyi tod ke bhaage	0	0
kaanchi re kaanchi re, kaancha re kaancha re	0	0
ye wakt tumpe aa jaye pyar me, to ye geet gaana	0	0
kaise rahun chup	0	0
prem ki bhasha ui prem ki bhasha	0	0
pyar ki jisme hoti hai puja ye pritam ka ghar hai	0	0
ab ye dhul ye sadak apna jahaan, apna jahaan	0	0
nadi ki mast adaye bula rahi hai tumhe 	0	0
din-b-din vo mere dil se	0	0
bolo kya dil bekraar hai, hai 	0	0
mai agar bichhad bhi jaaun, kabhi meraa gam na karanaa	0	0
chhota sa ghar ho apna, pyara sa jag ho	0	0
ho baakpan tera pyar ki ada, hosh le gayi sarkar ki ada	0	0
ho o o o	0	0
aai hi hi o ho ho ho	0	0
kabhi kuchh kahati hai, kabhi kuchh kahati hai, zara nazar ko sanbhalana	0	0
jayegi meri doli tere hi aangna	0	0
aji andar kya hai, aji baahar kya hai	0	0
ke tak tak nain thak gaye jind meriye	0	0
hum bahut ho ya kam baant lenge 	0	0
tujhase milake zidagani hay kitani suhani ho gayi	0	0
koi mane ya na mane, sach kah gae hain log purane 	0	0
aankho kaa ujaala pardesee le gaya	0	0
gila tumase nahi koi, magar afasos thoda hai 	0	0
jaungi unke ghar, jinse laagi lagan	0	0
bazm yun hi khili rahe apani nazar mili rahe	0	0
dono sath bajayenge  sath-sath khanakayenge	0	0
kon ye jane kab mil jaye raste me ham raz koi	0	0
kaisa chor kaha ki chori kaisa chor kaha ki chori 	0	0
man bina ke madhur suro me, gate hai sab prem tarane	0	0
my heart is beating, keeps on repeating	0	0
kisi se kya gila, 	0	0
kaliya chura ke tera gazra banayenge	0	0
ha ha baat ban jaye	0	0
taare ginata mai rahata hun, jagata rahata hun, raato me	0	0
aaun jamuna ke tir jamuna ke tir jamuna ke tir re	0	0
meri jaan wah wah wah	0	0
tu sab kuch jane hai har gum pahchane hai	0	0
nahi bhulti uf wo jangal ki raat, yad hai wo thi mangal ki raat	0	0
ye jo aap hi unse ruthh gayi	0	0
tukar tukar kya dekhta hai beiman 	0	0
nambar sath kare jo danga ek hath me	0	0
meri baat bane na bane	0	0
tu jo kuchh bhi aaj kahegi hoga ik bahana	0	0
kaho pyar hai tumse, o sily	0	0
pyaar ki galiya, baago ki kaliya	0	0
pehle bhi tumhe dekha pehle bhi tumhe chaha	0	0
aisa na ho teri yad me main bad me aahe bharu	0	0
hamko dar hai ke ye tauhin-e-muhabbat hogi, muhabbat hogi	0	0
mehanat kare insan to kya kam hai mushkil	0	0
badan aanch khakar pighalte hue	0	0
itana bhee dur mat jao, ke pas aana mushkil ho	0	0
tujhase maangee thee ek khushee maine, tune gham bhee nahee diye apane	0	0
mat bhool aare insaan	0	0
shisha ho ya dil ho aakhir tut jata hai 	0	0
zindagi me gum bhi milte hai	0	0
surama meraa nirala, aankho me jisne dala	0	0
hansta hai koi surat pe meri	0	0
ho chandamama dur ke, puye pakaye bur ke	0	0
naihar se ghar jati dulhan kyo naina chhalakaye	0	0
haay haay yeh majburi, yeh mausam aur yeh duri	0	0
are bolo re jisne banaya rup re	0	0
anaadi divana	0	0
dil se nikli hay mujhe jab dekha nain jhukaye gulo ki dali ne	0	0
ha baba ha janati hu 	0	0
biraha ki agani ko asvan se bujau kaise	0	0
meri jaa husn pariyo sa kaha se laayi ho bolo	0	0
matalabavaa ek hai ek hai nainan pukaar kaa	0	0
mujhe ek jagah aaram nahi ruk jana mera kam nahi	0	0
sare chirag buj gaye mai dekhata raha	0	0
ik nazar fer le jine ki ijaazat de de	0	0
sab ke sine me yahi dard ubharate hoge	0	0
pyaar se sikhalaiyo o o	0	0
mujhe bhuk nahi lagti mujhe pyas nahi lagti	0	0
kimat waare aayenge dwaare leke sang barat re 	0	0
bura hota hai raho me machalna, aji achha hai ruk ruk chalna	0	0
cause love u know	0	0
har baar tumhi ne maang bhari	0	0
ik ghar banaunga, tere ghar ke samane	0	0
hm hm hm hm hm	0	0
apana bana le meri jan 	0	0
hota hain jab pyar to lagata hain pani sharab	0	0
aanaa hai baar baar, aanaa hai baar baar	0	0
ro raha dil mera 	0	0
ho gagariya phod daari	0	0
issaro ko ager samjho to raz ko raz ko rahne do	0	0
reh gayi zanjeer-e-sitam	0	0
aqabar mera nam nahi hai	0	0
sirf itni si khata par hume dushman jana	0	0
lena hoga janam hume kayi kayi baar	0	0
gi: kaisa ye pyar hai, kaisa ye naz hai	0	0
ulfat meri jiti anaadi piyaa haare	0	0
mere taal taal kyun tu faraar, bas tu hi mit ghanera hai	0	0
thokar lage na sambhalo sanam	0	0
ghar mere aya wo mehaman	0	0
are bachaao, are bachaao, 	0	0
prit bhare man ki ye duniya	0	0
duniya ki nazro se dur jate hai ham tum jaha	0	0
mat puchho auro ke dukh me, ye prem kavi kyu rota hai	0	0
naino vaali tere dvaar leke sapane hazaar 	0	0
sath tera nahi	0	0
aa tujhe main de doon prem ki nishaniyan	0	0
chal chhodo ise diwani mat kar barbad jawani	0	0
ke tera haal kya hai, ke tera haal kya hai	0	0
muthukodi kawadi hada muthukodi kawadi hada	0	0
kyo na kah de mohabbat khuda hai	0	0
duniya bhar ke dande sar pe khaye danadan	0	0
awaara badal ko saudaayi paagal ko	0	0
mai pital kee payaliya bhee pehanu jo panv me	0	0
ya qurbaan, ya qurbaan, ya qurbaan, ya qurbaan	0	0
phir se kahi ab jod dunga ari tere bina hatho se apne	0	0
kisine chalo dushmani ki magar 	0	0
kitni gehari jhil hai ye jhil se gehari do aankhe	0	0
c a t cat, cat maane billi, r a t rat, rat maane choohaa	0	0
jab zulmo ka ho samna tab tu hi hame thamna 	0	0
kurta malmal ka ho kurta malmal ka	0	0
tut naa jaaye sapne mai darta hu	0	0
jamin phat jayegi, jamin phat jayegi suraj kaa gola tut jaayega	0	0
aake maikaane me jine kaa sahaaraa kar le	0	0
pee ke mukh se basuriya	0	0
har taraf bajne lagi, saikdo shahnaiyaa	0	0
kis liye kis liye ho 	0	0
is par jo ankh uthayega zinda dafnaya jayega	0	0
jamin toh hai, jamin yeh aasman ko bhi hilaayengi	0	0
hath pasare phirta hai	0	0
ab ye sapne mere 	0	0
kitne hasin khwab ban jate hain uname se 	0	0
ye gotedar lahanga niklu jab dal ke	0	0
dhire se tera ye muskana 	0	0
ho rabba itti si bat na jana	0	0
thake hue in haatho ko dede mere haath me	0	0
dhum machi hai maikaane me, tu bhi machaa le dhum dhum dhum	0	0
hu hu hu hu hu hu	0	0
ik baat kahenge sabase nafrat ko mita jag se	0	0
fizao ka nazaro ka mai mastana musafir hun	0	0
dhire se jana khatiyan me 	0	0
dekha hasa diya tujhe o tange wale yar	0	0
shisha-e-dil itana na uchhalo	0	0
dha ma dha marte hai, ma re ma jite hai	0	0
teri bewfaayi pe, hanse jag saara	0	0
koi na mile to akele me gana	0	0
aji dekhiye to kya haseen rat hai	0	0
mitwa mere yar tujhko bar bar aawaj mai naa dunga	0	0
dhundh dhundh ke har insaan	0	0
daddy phir dekho sapne salone	0	0
anchal na chhod e mera, pagal hui hai pavan 	0	0
yaadon me vo sapno me hai jaayein kahan	0	0
	nain se tere is maang me jaise sitaare bhar ga_i hai	0	0
udhar uthaya idhar bithayapakad ke meri baiya ji	0	0
kali ghata chhayi, prem ruth aayi	0	0
akhiyo ke jharokho se, maine dekha jo saavare	0	0
pichhe gujara hua ek zamana bhi hai	0	0
meraa kyaa hogaa, socho to jaraa	0	0
usne kaha takta hai kya, maine kaha surat teri 	0	0
divaar-o-dar ko gaur se 	0	0
kavaariyo kaa dil machle jind meriye	0	0
mahake badan me raha na jaye, raha jaye na	0	0
koyi tujh sa nahi hajaro me	0	0
jhutha kahi kaa ha, hare raama hare krishna	0	0
hungama sadak par hone ka sabab hai	0	0
ho chachal chalak magar aurat ka dil jane nahi	0	0
ha joru teri sar ghumegi roz kahegi gadha	0	0
kahaan le chalaa hai manavaa	0	0
samajh kar zara gaur farmaiyega	0	0
aaye mere sapne to ye kar na de inkar	0	0
chahat ke dastur tujhko sikhaaun chahat ke dastur tujhko sikhaaun	0	0
jo kuchh nahi toh yeh ishare kyon, thahar gaye mere sahare kyon	0	0
mushkil nahi hai kuchh bhi	0	0
agrezi me kahate hai 	0	0
satate naa ham to manate hi kaise	0	0
upar wala jan kar anjan hain	0	0
miliye ab is gori se, miliye ab is gori se	0	0
lekin ye kya ke gair ka ahsaan lijiye	0	0
shayad ye raat bite karwat badal badal ke	0	0
aankho me kya ji, rupahala badal	0	0
karke deedaar yaar aaj dil jhum utha 	0	0
wo phool tha aur ke jude ka	0	0
jawani o diwani tu zindabaad	0	0
hosh me rahne de madhosh na bana	0	0
kaise vaqt me hay hay kaise vaqt me, kaise vaqt me hay 	0	0
sharma gayi main, ghabra gayi main	0	0
ubhari bernag lakire, dekho ye tasvire	0	0
mera yaar bada sharmeela mera yaar bada sharmeela 	0	0
kal milo ya paraso, paraso nahi, naraso	0	0
dekhu tujhko jo hi ho jau pagal, pagal	0	0
ho, hamne sajai pyar se apni galiya	0	0
kaam ki baat bata di maine comedy gaana gaa ke	0	0
mere mathe pe teri nishani rahe, nishani rahe	0	0
yeh toh usaka war hi batalayega	0	0
nazar bolati hai, dil bezubaa hai	0	0
tere bin mai kya mere bin tu kya ik duje bin ham akele	0	0
kali ghatao ka kajara laga dun	0	0
moko moko nadekhe jara tikde ye jar atikde ye	0	0
hamrah tera koi apna to hai	0	0
ho, khilauna, janakar tum to, mera dil tod jate ho 	0	0
saans ke sang hi toote	0	0
main jatt yamla pagla deewana main jatt yamla pagla deewana	0	0
aaj se apnaa waadaa rahaa o mitva	0	0
ho prit ki dor	0	0
kare bhalai ham, bure bane har dam	0	0
ganga meri ma ka nam, baap kaa nam himala	0	0
mehnadi lagi mere hath re mehnadi lagi mere hath	0	0
aage chalun to dhadakati hai saari aganaai	0	0
pyaare maama o maama	0	0
tumhe har ghadi chumanaa chaahataa hai	0	0
tere husn ki kya taarif karun kuchh kahate hue bhi darata hun 	0	0
dekho dil na todo aai shaam suhaani	0	0
kya mil ke kya kho gaya	0	0
khudaa ke paas jaanaa hai	0	0
uske sine me bhi dil dhadka ye usne bhi kaha, kya 	0	0
kya kaha phir se to kahna hath lekar hath me, ho ho haha hoho	0	0
vardan ke	0	0
pyar ko thokar mat lagana	0	0
kisne machaya yeh shor kaun hai, kaun hai bhayi, yeh toh parda hai	0	0
kitne ye makkar ye adhe	0	0
gori tujhako to aj nahi ana tha	0	0
haske mohe lut gaye, kuchh kaha toh ruth gaye	0	0
jo guzar gayi, kal ki baat thi	0	0
bato ke badle aankho se lo kam, varna hum ho jayenge re badnam	0	0
mere jiwan ke o re khewaiya	0	0
sing om shanti om, shanti shanti om	0	0
piya dekho, diye jalate hain, achchha 	0	0
i am waiting for you	0	0
jin naino ki tu hai jyoti	0	0
maan ke to dekho kabhi kisikaa kahaa	0	0
jo vaada kiya woh nibhaana padega	0	0
de duae,  de duae tujhe umr bhar ke liye	0	0
koi iska ticket kata do, meri maa mujhe bacha lo	0	0
duniya ko ab do nazar kyo aaye ham	0	0
aa jaye dil me jo wo dil se na jaye	0	0
aang se aa aang mile aa arama khil gaye 	0	0
sun mai bap sun mai bap rahe khush tere lal	0	0
pyar kar le pal bhar ke pyar pe nisar sara jivan	0	0
budhe ka tajurba hota nojawano	0	0
ras barse nil gagan se	0	0
jaati hun do aansu lekar aashaae sab haar ke	0	0
hai na aasmaan ke liye	0	0
mai samajhta hu tum meree takdir ho	0	0
koi to ho aise puchhe baat jo, giru to pakad leve haath jo	0	0
ooei ooei palko ki in chawo me	0	0
tu nazar daal de jis par vohi maikvaar bane	0	0
kali kali chum ke pavan kahe khil ja 	0	0
parda na uthaao	0	0
bhor hone wali hai ab raina hai thodi, trampam	0	0
ye husn ke paravane ko	0	0
usne kaha tu kaun hai, maine kaha ulfat teri 	0	0
nayi dil ki duniya basa na sakuga	0	0
ro ro kar har dukh sehna hain	0	0
aahista aahista chhedo dilon ki kahani	0	0
pyar mohabbat	0	0
ab diye pe ye dukh padane lagaa	0	0
o o	0	0
in do naino ke sagar me, koyi dil ki naiya dubota hai	0	0
gaana aaye ya na aaye gaana chaahiye	0	0
dil me rahe aur hamara dil tod diyaa 	0	0
jhaanjhar jhanke jhana nana jhana nana	0	0
jie koi kaise aa yahi bataa jaa	0	0
dil ko teri hi tamanna, dil ko hai tujhse hi pyaar	0	0
pagale han pagale	0	0
jab bhi koi aahat hoye, manva mora bhaage	0	0
kud ko bhi hamane mitaa daalaa magar	0	0
koun bujhaye koi ye samjhaye re nind na aaye	0	0
sawan me bas rup tihara	0	0
arre tere sadke jaaungi re maike nahi jaaungi	0	0
hilamil ke chalana yun hi sathi	0	0
paas aaja, o sun raja aisa mauka naa jaye nikal, chal	0	0
daulat haram ki na na, hai ye kis kam ki ha ha	0	0
mushkil raahe yaha, ashk aur aahe yaha	0	0
aa aa mil ke daman daman se bandh le 	0	0
are pahali shararat kisane ki isane ki 	0	0
yari meri kahti hai yar pe karde sab kurban	0	0
kee har chij maalik ne hai sundar banaayee	0	0
chale aa rahe hain wo nazre jhukaaye	0	0
barasun unake jivan me	0	0
tadapati hui meri jaan tu nazar aayegi 	0	0
kahi bite na 	0	0
sanson se hun kaise juda apno ko dun mai kaise bhula	0	0
tumane kabhi pyaar kiyaa tha kisi raahi se	0	0
tera husn ye sham rahe naa rahe	0	0
bhul ja bachpan ki rang raliya aaye din shrmane ke	0	0
chal mere bhai tere hath jodta hu	0	0
raat ko khidki khol ke rakhna, haay raam tum aaoge	0	0
kab niklega iska dewaala	0	0
birha ki aag mein jalte dekha 	0	0
bhige kitna bhi ang thandi ho na umang	0	0
thahar jaao suno mehaman hun mai chand rato ka 	0	0
dil ko laga ke dekho pyar me kya khushi hai	0	0
ye sab andaz mil kar do jaha ko lut jayenge	0	0
yuhi shamma banke jala karu	0	0
laa laa la laa aa aa	0	0
chhedo dhun matwaalon ki behki behki chaalon ki sheher se door	0	0
par kajal rachaye na	0	0
yeh din toh aata hai ek din jawani me	0	0
har gam ki koi dwa hain darde dil to chiz kya hain	0	0
bhul kar raah koyi hasin aa na jaye	0	0
saadgi mein chhupa shokhiyon ka sama 	0	0
meree raaho se tujhako kal kee tarah, dukh ke kaante nikaalane honge	0	0
sapt suran tin graam bansi baaji	0	0
kabhi maine hans ke dipak jalae 	0	0
der se aana aur ye kahna vada to nibhaya	0	0
daaye hi nahi baaye bhi, upar hi nahi niche bhi, e bhaai	0	0
ram ki is dharati ko gautam ki bhumi ko	0	0
ke khilne de kali dil ki agar khilti hai dilbar	0	0
jo dil me hai hoto pe lana bhi mushkil	0	0
to parvaane kahaan jaate	0	0
powder wo lagaye na	0	0
chhaliya re, na buze hain, kisi jal se ye jalan	0	0
tum tak jo pahuchati hai is mod se jaati hai	0	0
jab aati hai rut pe javani, tab banati hai prem kahani	0	0
akad kis baat ki pyaare	0	0
aha aha shyahi aha aha	0	0
ehsan mere dil pe tumhara hai dosto	0	0
manzil vahi hai pyar ki rahi badal gaye	0	0
jaan jo mujh par dete rahe hai	0	0
kaiso re paapi bichhua bichhua 	0	0
tum to aaine se bhi aankhe milaya na karo 	0	0
ghar me bhigi billi sare sahar ko ankh dikhaye	0	0
mohabbat pe ehsaan hota tumhaara	0	0
ra: mai dhadakan tu dil hai piyaa	0	0
nahi bhulega meri jan yeh sitara woh sitara	0	0
teri duniya se dur, chale hoke majbur	0	0
luta kahi mara nahi	0	0
bedari ka sama tha	0	0
ye dil aur unki, nigaaho ke saaye	0	0
kuchh aise log bhi hote hain, kuchh aise log bhi hote hain	0	0
palkon bich saja loon tumko ankhon me bithlaun	0	0
aur phir sharam se bal kha ke simatna uska	0	0
dosti hain bhayi toh bahana hain pyar	0	0
dam lene ko jahaa ruko tum	0	0
to hame yad dilana, ho bhul na jana	0	0
isme kushiya hai kam, beshumaar hai gam	0	0
ise bhangda kon nachaye	0	0
dekhe jise akeli use kare athkheli	0	0
kisko apna kahu ab mai jau kaha	0	0
jab bhi udaasi cha jayegi 	0	0
tan tanakar zalim ne apana har tir nishane par mara	0	0
duniya ki sair kar lo, duniya ki sair kar lo	0	0
mujhko bas aavara samjha jis ne mera naam suna	0	0
gaalib ki gajhal jaisi mumtaj mehal jaisi	0	0
ho ho khoya khoya chand khula aasman	0	0
ek chor nikalta hai kaali si sadak pe ye avaz aati hai 	0	0
nahi re nahi main nahi jaungi tere sath tera hath tham ke	0	0
mera tu, mera tu, mera tu, aa	0	0
yu mat dekho aanchal chhodo du mai ram duhai re	0	0
are rafta rafta dekho ankh meri ladi hai	0	0
are aao na akele, kabhi raho na akele kabhi, 	0	0
dil key maron ko dil key malik	0	0
o basanti	0	0
munne ki amma ye to bata, tere bete ke aba ka naam kya hai 	0	0
teri rab ne bana dii jodi	0	0
nahi to mai samajhugi, mujhse kafa ho	0	0
mere dil me rahna chaahe	0	0
lab pe duaye haay re ghazab	0	0
o kehne wale mujhko farebee	0	0
kahege ye jahaan vaale	0	0
sab waqt ki hera feri hai	0	0
ruk ja o jane vali	0	0
mohabbat mein itanaa, naa hum ko sataao	0	0
koi dushman tha ye man mera 	0	0
reshami salwar kurta jaali ka	0	0
ab ham to kya sari dunia, sari dunia se kahti hai	0	0
ho.. bekarar si larajti	0	0
dor se patang jab toot jaati hai to,	0	0
are re re lut liya re jhaanjhar wali ne	0	0
mere dil ka dard samajh kar do aansu to bahayega	0	0
aayi thi wo dhum se chali gayi cham cham cham	0	0
jaise bhale ho sab hai khabar	0	0
sajani pe dil aa gaya ke sajani pe dil aa gaya 	0	0
tujhe suraj mai kahta tha magar usme bhi aag hai	0	0
rahman bhi hai ye to batlao ke inme kahi 	0	0
tum se shuru, tumhi pe kahani khatam kare	0	0
aaya nahi abhi tak udharse koi jawab dekho	0	0
kar le sagai meri jan hay re mai tere kurban 	0	0
teri kaunsi hai manzil, kahi dip jale kahi dil	0	0
te mai purab ka jat baby	0	0
ha yahi to the abhi aap kidhar gaye	0	0
mere dildar ki shaadi hai	0	0
ped jala dhup me log baithe saye me jindgi	0	0
ham tera nam sunake chale ae hai	0	0
la ke tasavir hi tum dikha do hame	0	0
rakh do duniya me apane pyaar ka ik nisha	0	0
asli wale wo hai are jo hai himmat wale	0	0
mere husn ka har andaaz mastaana	0	0
arre o hum pe marne waale teri khair nahin	0	0
wo kaun hai jo aakar khwabo pe chha gaya hai	0	0
pyar ki bela sath sajan ka phir kyo dil ghabaraye	0	0
honi to phir bhi bichhada yaar milaye	0	0
na duniya na duniya ke dastoor hote	0	0
toba re duhayi hoti meri ruswayi hoti	0	0
rone kahoge ro lege	0	0
teri mehnadi lekar dina ugaa, dina ugaa	0	0
oho kaam to bataayiye bataayiye, na na na	0	0
bant le ham kyo na 	0	0
dega aisa mantar maar aakhir hogi teri haar 	0	0
tu jo pukare mujhe ras ki dubi tan me 	0	0
natkhat naina, na maane mera kehna	0	0
ho ho ho jaam me dub gayi yaaro mere jivan ki har shaam	0	0
wo bhi mujhe karna pada ha ha ha a	0	0
gam na karo din judai ke bahut hai kam	0	0
ye bekar bedaam ki chiz hai	0	0
lambu ka jamana hai lambe ka riwaz hai	0	0
aaj main aazaad hu duniya ki chaman me	0	0
udd ke poket me aa jaye hare not ki pari	0	0
dagamaga jayege aise haal me qadam	0	0
ho kab niklega iska diwaala	0	0
kachche pakke bal hain uske mukhda hai suhana, ichak dana 	0	0
leke chali mujhe apne sath	0	0
bhaiya mere, raakhi ke bandhan ko nibhana	0	0
haal ye hain masti ka, saans lagi thamne	0	0
dil ke bate dil hi jane 	0	0
ye apani kata hai, gila kya kare	0	0
yar aisa mil gaya, dil hamara khil gaya	0	0
maine patni pooja pyar me dooba biwi ke to	0	0
pyase gito ki ganga ka tu hi hai kinara	0	0
maine bad kar li, ha maine bad kar li	0	0
l: jhilamil sitaaro kaa aangan hogaa 	0	0
ho jaye usko automatic telephone	0	0
tanha dil na sambhalega, pyar bina ye tadpega	0	0
chhod  kar chal diye mujhako majhadhar me 	0	0
bataungi jawab de, sawal kar	0	0
jab chaand sitaare bhi soye rahe	0	0
du jispe naina dar, hatho se payala satak jaye  	0	0
nid mujhase, nid se mai bhagati chhupati rahi	0	0
ye muhabbat ki dasta suno	0	0
bahut chaahne waale mil jaayenge	0	0
hu hu, hay re hay re hay re	0	0
dil mera ek asa ka panchhi	0	0
udd gayi chunari udne do, kahe ka dar hai bali umar hai	0	0
paas agar tu aajaye sans sans takara jaye	0	0
nagma sa koi jaag utha badan me	0	0
dagmag chalke na gir padu mai gir ja 	0	0
ek ek dohe mein ek ek gyarah ek ek dohe mein ek ek gyarah	0	0
dhundhta hu tujhe har raah me har mehfil me	0	0
chamakte hain jab tak yeh chaand aur taare	0	0
jane kab kaise kaha had se fisal jaye 	0	0
hum unse kya hai kam, nachenge aise hum 	0	0
amaante mai pyar ki gaya tha jisko saunp kar	0	0
tum ko hamari umar lag jaye	0	0
apani kahani chhod  ja, kuchh to nishani chhod  ja	0	0
vo kis tarah bhi mil jaye kismat me jinki milna hai	0	0
tujhe chaand ke bahaane dekhu jind meriye	0	0
rut aaye rut  jaaye deke	0	0
ki mara gaya ki mara gaya brahmachari	0	0
bataye tumhe kya kahan dard hai, yaha hath rakhana yaha dard hai	0	0
mai kaha jaau nahi koi meri manzil	0	0
aji ruth kar ab	0	0
jab aankh khuli woh tut gaya	0	0
sabse bada sach ek jagat me bhed anek jo khole 	0	0
tum khayalo ki ye tasvire banaya na karo 	0	0
paanv rakho aage-pichhe aankhe upar haath thoda niche	0	0
rat adhi bat baki hum bahkte rahe	0	0
ik duje me ho jaae gum	0	0
chhalakaae jaam aaiye aapaki aankho ke naam	0	0
pyar ke liye magar paisa chahiye	0	0
khench le na woh mera parde ka kona daffatan	0	0
ham kahi aur dil kahi hai ho	0	0
ghodeji ki nai ne hazamat jo banai	0	0
kubasurat hai tu rut javaan hai	0	0
hamaare liye hai yahi aashiya, yahi aashiya	0	0
akhiyo ke jharokho se 	0	0
chhuriya chal jaye meri matwali chal pe	0	0
mujhe koi sajdo se rokega kya	0	0
tan bhi sundar man bhi sundar	0	0
tu aaftaab jaam-e-shabaab roshan huye maikhaane	0	0
mujhe pyar karo mujhe pyar karo 	0	0
aaj ki raat murado ki barat aayi hai	0	0
sardi me jab pioge yaaro 	0	0
dil apna aur prit parayi, kisne hai ye rit banayi	0	0
mujhse behatar kahne wale tumse behatar sunne wale	0	0
ho jau na mai diwana kahi ab kya hoga kya hoga	0	0
kahi dur thaa tufaan, diye se thaa balavaan	0	0
aap nind nahi kya aayi nind meri aap ne churayi	0	0
jaiye aap kahan jayege ye nazar laut ke fir aayegi	0	0
mere dildaar ka baankpan haay baankpan 	0	0
pyar sanam pyar khuda, yar kabhi ho na juda	0	0
jab se tujhako dekhaa hai, dekh ke khuda ko maanaa hai	0	0
bin taale ki chabhi le kar phirte maare maare	0	0
ham me tum me dosti ham kyu bane dushman	0	0
are are milake bajao baaja, halva khaao taaja	0	0
kal nahi ana mujhe na bulana ke marega tana zamana	0	0
ha bura ho waqt to 	0	0
dil me rahe aur hamara dil tod diyaa	0	0
jab tak jawani hai, ye rut suhaani hai	0	0
na na na, na na na	0	0
teri aankho ke saaye churaye, rasili yaado ne	0	0
yah na soch tuu bach jayega shor mach jayega	0	0
na dir dir dha ni ta dha re dim dim ta na na	0	0
java dharati ke ajane kinaro ka mai aashiq hun baharo ka	0	0
waqt hai bahut hi kam aur bada kaam hai 	0	0
o puttara thande thande paani se nahaana chaahiye	0	0
purab ho paschim uttar ho dakshin tu har jagah muskuraye	0	0
dharat paag padat nayi paran	0	0
jhume ye sawan suhana, suhanaa	0	0
ho maine to ki thi dillagi, achchha maine bhi ki thi dillagi 	0	0
sath diya hai, in lahro ne	0	0
ek to surat pyaari upar se gusse ki laali	0	0
mujhe ghm bhi unka ajeez hai	0	0
main jatt yamla pagla deewana	0	0
ham gulaam aapake hain lijiye bandagi	0	0
agar tu ladki hoti	0	0
aur kisi ko nahi pahchati chhodo chhodo ye to bahae hai	0	0
janam janam se aankhe bichhaai tere liye in raaho me	0	0
kaisa yeh riwaj hai duniya ki saraye me	0	0
aaj se hoga vah dukh mera dukha hai jo tumhara	0	0
raah me kho jaaenge aaj toh haay	0	0
mujhe tumse muhabbat ho gai hai 	0	0
tum ho baah me dil ki rah me, tum khayal me tum nigah me	0	0
sara jaha ga raha hai banke bahar cha raha hai	0	0
chale the sath milke chalenge sath milkar	0	0
chhoti chhoti khushi chhote chhote wo gham	0	0
chal yar dhakka mar, band hai motar kar	0	0
mulakaat par itne magarur kyon ho	0	0
bolo na bolo mukh se gori chudi tumhari bole	0	0
ho ho main hoon uski lalpari aur wo mera gulfam	0	0
bhul gayee sab kuchh, yad nahee abb kuchh	0	0
aankhen dale aankhon mein, jane mujhse kya woh puchhe 	0	0
suraj ko dharti tarse dharti ko chandrma 	0	0
dharati pe ladi tune ajab dhang ki ladaai	0	0
chori-chori chupke-chupke, tere mere bin is kamre me aur kaun hai	0	0
ban ke kali  ban ke saba  bage vafa me	0	0
komal komal hai inka badan kante si teri chubhan 	0	0
juba khul jaye agar meri to chakana chur kar du	0	0
are jalti shama se milake gale, paravaane jal jaaege	0	0
banke baadal karo barasaat	0	0
yaad aa rahi hai, teri yaad aa rahi hai	0	0
aah aah aaja, aa e e aaja, aah aah aa	0	0
main samjhun jag hai deewana	0	0
pyaar kaa rang hai fizaao me	0	0
dil me to ye hasrat hai tere pas mai aau	0	0
in hatho me taqat tumhari hai	0	0
koi ise bhi, yaad aa rahaa hai	0	0
tum hi tum ho mere jivan me	0	0
dil pe marane vale marenge bhikhari	0	0
oye ghar ke siva jana kaha ghar me hi daftar bana lunga	0	0
chal chameli baag mein chori se jaayenge	0	0
jhumti jamin ko aasman mil gaya	0	0
tum ho vo dilruba, tum ho vo dilruba	0	0
oh isase purani ek kahani, teri meri prit re 	0	0
jaana, o meri jaana are mai hu tere khwabo ka raja	0	0
mera mahabub aaya hai 	0	0
jaane kyaa tune kahi	0	0
chalo acha hua mar kar jaha se chut jayenge	0	0
chal aa aaj tujhko mohabbat sikha de 	0	0
ki tere bin naiyo labadi, o saathi ho, ni baliye	0	0
ni sultaanaa re pyaar kaa mausam aayaa	0	0
jindagi hame tera aitbar na raha, aitbar na raha	0	0
chana zor garam chana zor garam	0	0
jaisa maine socha tha	0	0
jara paas aayo to chain aa jaaye	0	0
iske siwa ab duji koyi chah nahi	0	0
mujhko ye din dikhlaayaa	0	0
gulashan me fulo ke sath khilate hai dil me gulab	0	0
mere haatho ki garami se, pighal jaayegi zajire	0	0
hamaare bade bhaag hui tumse mulaakaat 	0	0
ye dulari shandar hai	0	0
chahte badh ke pashemaan bhi ho jaati hai	0	0
jo in maujo me duba, usne hi duniya payi	0	0
kyun na rotiyo ka ped ham lagale 	0	0
iss dil ko tasalli de dena, ghabaraye kabhi toh mat rona	0	0
haan, dil abhi bharaa nahi nahi nahi nahi nahi	0	0
agar tu ladki hoti, agar tu ladki hoti	0	0
tere bina sawan sune	0	0
chal mudadiye te mud jaaye	0	0
aur roz club me jaate hain, log bhakti bhajan sab bhool gaye	0	0
dhaa titakita tak dum titakita tak	0	0
tumne aate aate 	0	0
teri najro ki pyasi kabhi thi mai teri dasi ab hu mai teri malik sun	0	0
akela chala chala chal fakira	0	0
chandamama dur ke, puye pakaye bur ke	0	0
main shokh kali chanchal titli	0	0
samjho hame ham jan se guzar gaye	0	0
ye fir u hai aise nakhare kon uthaye	0	0
jane kaise ye kab hui gava re	0	0
tere sehre ki hai ye ladiya ki savan ki jhadiya	0	0
roshani hogi itani kise thi khabar	0	0
sala ho ya ho vo sali, yane ki adhi gharwali 	0	0
baaho me daal le	0	0
dekhe mile kab apne naseeb 	0	0
bandhi usse jivan dori todke sab se nata re nata todke sab se nata	0	0
agar dil me gam ho to rote hai ansu	0	0
ho ab kya hoga yaro ab kya hoga	0	0
teri nind ude te ud jaaye	0	0
bhalaa tune inaam kyun de diyaa 	0	0
itna sa kehna hai aa aa aao	0	0
zulfon se ghooghat ka kaam le aise ka kya koyi naam le 	0	0
dar dar ke jina kya	0	0
chhup gayaa koee re, door se pukaar ke	0	0
sharbati ankho ke doro me nasha hota hai	0	0
sajte hain jo tan pe hamare	0	0
ek jhalak jo pata hai	0	0
ya garmiyo ki raat jo purwayiya chale	0	0
lagata hai dar fareb bevafaa se kabhi kabhi	0	0
ho hum to nahi wo diwana jinko	0	0
huuo apne ghar ke raaja tum aa chhedo man ka baaja tum 	0	0
haath apne uthakar mai kya maangata	0	0
har janam me tujhe apna maana sanam	0	0
char baje mai soya tha panch baje uth jaga	0	0
hindu muslim sikh isaai sabko mera salam	0	0
aa haa ha ha ha ha ha, o ho ho ho ho ho	0	0
chhune se jisako, sine me meri	0	0
sawan jo sandesa laye, meree aankh se motee paye	0	0
ek saval mai karu ek saval tum karo	0	0
nanhe nanhe paav hai tere choti choti baahe hai 	0	0
o nirdayi pritam, o nirdayi pritam	0	0
zara khayal rahe dil ajab nishani hai	0	0
jab aau punjab to, bhangde ka ban jau mit	0	0
rehta nahi hai andhera	0	0
ye kya kam hai kabhi mujhse	0	0
nila ambar muskaye, har sans tarane gaye	0	0
bhul se kar baithi vo mujh jaise kangal se shadi	0	0
nashe se palke tani tani, jaan pe meri bani bani	0	0
